{
  "meta": {
    "title": "返し鈴",
    "version": "v0.7",
    "language": "ja",
    "estimatedMinutes": 5,
    "description": "現代の一晩に焦点を当てた和風ホラー短編サウンドノベル。",
    "scoreRules": {
      "trueChoice": 1,
      "neutralChoice": 0,
      "badChoice": -1,
      "voiceAnswer": "force_bad"
    }
  },
  "startScene": "title",
  "stateDefaults": {
    "score": 0,
    "bell_handling": null,
    "ema_action": null,
    "voice_action": null,
    "ending": null
  },
  "scenes": [
    {
      "id": "title",
      "background": "black_rain",
      "ambience": "rain_light",
      "steps": [
        {
          "type": "text",
          "text": "雨の音だけがしている。\n\n遠くで、鈴が鳴った。\n\nちりん。"
        },
        {
          "type": "title",
          "text": "返し鈴"
        },
        {
          "type": "jump",
          "next": "mother_intro"
        }
      ]
    },
    {
      "id": "mother_intro",
      "background": "black_plain",
      "ambience": "silent",
      "steps": [
        {
          "type": "text",
          "text": "雨になりそうだから、早めに行ってきなさい。\n\n母はそう言って、玄関まで見送りに来た。\n\n靴を履く私の背中へ、鍵の鳴る音がした。"
        },
        {
          "type": "voice",
          "text": "「遙、気を付けて行ってらっしゃい」"
        },
        {
          "type": "voice",
          "text": "「うん。暗くなる前には戻る」"
        },
        {
          "type": "text",
          "text": "祖母の家の鍵は、掌の中で思っていたより冷たかった。"
        },
        {
          "type": "jump",
          "next": "house_intro"
        }
      ]
    },
    {
      "id": "house_intro",
      "background": "old_house_evening",
      "ambience": "rain_light",
      "steps": [
        {
          "type": "text",
          "text": "祖母の家には、まだ祖母の匂いが残っていた。\n\n畳に染みた線香の匂い。古い箪笥。湯呑みに残った薄い茶渋。片付けるものは思っていたより少なく、祖母が最後までこの家をひとりで整えていたことが、部屋のあちこちから伝わってきた。\n\n雨が降り出したのは、仏間の押し入れを開けた頃だった。"
        },
        {
          "type": "jump",
          "next": "butsuma_box"
        }
      ]
    },
    {
      "id": "butsuma_box",
      "background": "butsuma_night",
      "ambience": "rain_medium",
      "steps": [
        {
          "type": "text",
          "text": "押し入れの奥に、古い木箱があった。\n\n箱は褪せた紐で結ばれている。蓋には墨で文字があり、懐中電灯を当てると、かすれた線がゆっくり浮かび上がった。"
        },
        {
          "type": "document",
          "text": "『返鈴箱　片桐家』"
        },
        {
          "type": "text",
          "text": "紐に触れると、指先に冷たさが残った。\n\n部屋の中は、さっきより暗い。"
        },
        {
          "type": "text",
          "text": "箱の中には、黒ずんだ小さな鈴が入っていた。\n\n白い布。古い紐付きの巾着。古い写真。紙が二枚。\n\n鈴は動いていない。ただ、見ていると、こちらが息を止めてしまう。"
        },
        {
          "type": "jump",
          "next": "documents"
        }
      ]
    },
    {
      "id": "documents",
      "background": "butsuma_night",
      "ambience": "rain_medium",
      "steps": [
        {
          "type": "text",
          "text": "一枚目の紙は、古い和紙だった。\n\n墨はところどころ薄れているが、文字は読める。"
        },
        {
          "type": "document",
          "text": "『返鈴覚書\n\n雨夜 家に返り来たる鈴は 素手にて取るべからず\n鈴を鳴らすべからず\n名を口にすべからず\n呼ぶ声ありとも 答ふべからず\n\n暁までに 社の絵馬掛の下に納むべし\n\n返すこと能はざる時は 白布に包み 返鈴箱に納め置くべし\nただし 箱を開きし者は 次なる雨夜 また呼ばるるものと心得よ』"
        },
        {
          "type": "text",
          "text": "もう一枚は、祖母の走り書きだった。\n\n鉛筆の線が震えている。"
        },
        {
          "type": "document",
          "text": "『この箱を開けた方へ。\n\nこの箱はできるだけそのままにしてください。中の鈴には触れないで。\n\nもし雨の夜に開けたなら鈴を鳴らさず白布で包んでください。\n\n声がしても返事をしないでください。\n\n名前を読まないでください。\n\n朝まで箱を閉じていられるならそれが一番です。\n\nそれでも鈴が鳴り続けるなら覚書の通りにしてください。\n\n私は返せませんでした。』"
        },
        {
          "type": "text",
          "text": "遙は箱の蓋を閉じた。\n\n紐を結び直そうとした、そのときだった。\n\n箱の内側で、鈴が鳴った。\n\nちりん。",
          "se": "bell_far"
        },
        {
          "type": "text",
          "text": "廊下の方から、水を含んだ足音がした。\n\n一歩、また一歩。\n\n足音は仏間の前で止まった。障子の向こうで、子どもの声がする。",
          "se": "wet_footstep"
        },
        {
          "type": "voice",
          "text": "「それ、ぼくの」"
        },
        {
          "type": "jump",
          "next": "choice_bell"
        }
      ]
    },
    {
      "id": "choice_bell",
      "background": "butsuma_night",
      "ambience": "rain_medium",
      "steps": [
        {
          "type": "choice",
          "prompt": "鈴をどう扱うか。",
          "choices": [
            {
              "label": "白布に包む",
              "set": {
                "bell_handling": "bell_wrap"
              },
              "score": 1,
              "next": "bell_wrap_result"
            },
            {
              "label": "そのまま持つ",
              "set": {
                "bell_handling": "bell_pocket"
              },
              "score": 0,
              "next": "bell_pocket_result"
            },
            {
              "label": "鈴を鳴らして確かめる",
              "set": {
                "bell_handling": "bell_ring"
              },
              "score": -1,
              "next": "bell_ring_result"
            }
          ]
        }
      ]
    },
    {
      "id": "bell_wrap_result",
      "background": "butsuma_night",
      "ambience": "rain_medium",
      "steps": [
        {
          "type": "text",
          "text": "遙は白布を広げた。\n\n鈴には触れない。布越しに包み、箱の中にあった古い巾着へ入れる。紐を絞ると、鈴の形だけが布の奥で小さく浮いた。\n\n音はしない。\n\n遙は巾着を上着の内側へしまった。廊下の足音も、それ以上は近づかなかった。"
        },
        {
          "type": "jump",
          "next": "road_to_shrine"
        }
      ]
    },
    {
      "id": "bell_pocket_result",
      "background": "butsuma_night",
      "ambience": "rain_medium",
      "steps": [
        {
          "type": "text",
          "text": "遙は鈴をつまみ上げた。\n\n思っていたより軽い。上着のポケットへ入れた瞬間、中で小さく鳴った。\n\n廊下の奥で、濡れた足が畳を踏む音がした。",
          "se": "bell_far"
        },
        {
          "type": "jump",
          "next": "road_to_shrine"
        }
      ]
    },
    {
      "id": "bell_ring_result",
      "background": "butsuma_night",
      "ambience": "silent",
      "steps": [
        {
          "type": "text",
          "text": "遙は鈴を持ち上げた。\n\n本当に鳴るのか。そう思っただけだった。\n\nちりん。\n\n音は小さかった。それなのに、家じゅうの雨音が一瞬で消えた。\n\n障子の向こうで、何かが息を吸った。",
          "se": "bell_close"
        },
        {
          "type": "jump",
          "next": "road_to_shrine"
        }
      ]
    },
    {
      "id": "road_to_shrine",
      "background": "mountain_path",
      "ambience": "rain_heavy",
      "steps": [
        {
          "type": "text",
          "text": "玄関の鍵は、なかなか開かなかった。\n\n外へ出ると、雨が傘を強く叩いた。右手に傘。左手に懐中電灯。白布に包んだ鈴は、巾着ごと上着の内側にある。覚書と祖母の走り書きは、台所で見つけた保存袋に入れた。\n\nスマホは圏外になっていた。\n\n家の奥では、まだ箱が鳴っている。"
        },
        {
          "type": "text",
          "text": "古い写真が、保存袋の中で曇っていた。\n\n軒下で懐中電灯を当てる。写真には、子どもが二人写っていた。社の前に並んで立っている。ひとりは、若いころの祖母に似ていた。\n\n裏には細い字があった。"
        },
        {
          "type": "document",
          "text": "『志乃と惣太\n社の前にて』"
        },
        {
          "type": "voice",
          "text": "「そう……」"
        },
        {
          "type": "text",
          "text": "惣太、と声に出しかけて、遙は口を閉じた。\n\n上着の内側で、鈴が少しだけ震えた。",
          "se": "bell_far"
        },
        {
          "type": "jump",
          "next": "shrine_ema"
        }
      ]
    },
    {
      "id": "shrine_ema",
      "background": "shrine_night",
      "ambience": "rain_heavy",
      "steps": [
        {
          "type": "text",
          "text": "社は、思っていたより近かった。\n\n雨の中で、鳥居だけが白く浮いている。石段には濡れた落ち葉が張りつき、懐中電灯の光を向けるたび、黒い水たまりが小さく揺れた。\n\n拝殿の軒下へ入ると、雨の音が少し遠くなった。遙は傘を畳み、柱のそばへ立てかける。"
        },
        {
          "type": "text",
          "text": "絵馬掛には、古い絵馬がいくつも重なっていた。\n\n字の消えたもの。割れたもの。紐だけが残ったもの。ひとつずつ光を当てていくうちに、写真の裏にあったものと同じ名が見えた。"
        },
        {
          "type": "document",
          "text": "『佐久間 惣太』"
        },
        {
          "type": "text",
          "text": "その横に、新しい紙の札が結ばれていた。\n\n他の絵馬より、ずっと白い。遙は懐中電灯を近づけた。"
        },
        {
          "type": "document",
          "text": "『名を声に出さないでください\n鈴は\n呼んだ人についていきます』"
        },
        {
          "type": "text",
          "text": "その言葉だけが、箱の中の走り書きと同じ息をしていた。"
        },
        {
          "type": "jump",
          "next": "choice_ema"
        }
      ]
    },
    {
      "id": "choice_ema",
      "background": "shrine_night",
      "ambience": "rain_heavy",
      "steps": [
        {
          "type": "choice",
          "prompt": "絵馬の前でどうするか。",
          "choices": [
            {
              "label": "名前を読まず、鈴を置く",
              "set": {
                "ema_action": "ema_place_bell"
              },
              "score": 1,
              "next": "ema_place_bell_result"
            },
            {
              "label": "書かれた名前を小声で読む",
              "set": {
                "ema_action": "ema_read_name"
              },
              "score": -1,
              "next": "ema_read_name_result"
            },
            {
              "label": "絵馬を外して裏を見る",
              "set": {
                "ema_action": "ema_remove"
              },
              "score": 0,
              "next": "ema_remove_result"
            }
          ]
        }
      ]
    },
    {
      "id": "ema_place_bell_result",
      "background": "shrine_night",
      "ambience": "rain_heavy",
      "steps": [
        {
          "type": "text",
          "text": "遙は、名の書かれた絵馬を見ないようにした。\n\n上着の内側から巾着を取り出し、白布をほどく。鈴を絵馬掛の下へ置いた。\n\n音はしなかった。\n\n社の奥で、子どもが泣く声がした。けれど、その声は近づいてこない。"
        },
        {
          "type": "jump",
          "next": "return_path"
        }
      ]
    },
    {
      "id": "ema_read_name_result",
      "background": "shrine_night",
      "ambience": "rain_heavy",
      "steps": [
        {
          "type": "text",
          "text": "遙は絵馬の文字に光を当てた。"
        },
        {
          "type": "document",
          "text": "『佐久間 惣太』"
        },
        {
          "type": "text",
          "text": "唇が、名前の形に動いた。\n\n声にした瞬間、白布の中で鈴が跳ねた。耳元で、子どもの声がする。",
          "se": "bell_close"
        },
        {
          "type": "voice",
          "text": "「呼んだ」"
        },
        {
          "type": "jump",
          "next": "return_path"
        }
      ]
    },
    {
      "id": "ema_remove_result",
      "background": "shrine_night",
      "ambience": "rain_heavy",
      "steps": [
        {
          "type": "text",
          "text": "遙は絵馬に手をかけた。\n\n紐は、思っていたより簡単にほどけた。絵馬の裏には、墨の薄れた文字がある。"
        },
        {
          "type": "document",